question,selected,diversity
我跟老公离婚老公说一分钱都不给我这怎么办,"我跟老公离婚，他说一分钱都不给我，怎么办？, 离婚时，我老公说不给我一分钱，我该怎么办？, 离婚时，我老公坚持不给我一分钱，能如何维权？, 老公说离婚时不给我一分财产，我可以怎么做？, 如果老公在离婚时不给我任何财产，我该怎么办？",6.85459703207016
猪场占地合同到期拆迁国家给补偿吗?,"猪场合同到期后，国家是否会提供补偿？, 合同期满拆迁猪场时，国家会提供什么样的补偿？, 合同期满后，猪场被拆迁时，国家如何补偿？, 如果猪场合同到期，拆迁时是否可以获得补偿？, 如果猪场合同到期，拆迁时需要支付建筑物补偿吗？",6.265128493309021
我们河*驻*店*舆*房*局就那么不*事吗？民心怨交房日期延长了六年了如今还没有一点动静,"我们的房产项目为什么已经延迟了六年，仍然没有任何进展？, 经过六年的等待，河驻店舆房局为什么依然没有交房的任何计划？, 为什么已经六年的时间过去了，河驻店舆房局依然没有解决交房问题？, 六年时间过去了，河驻店舆房局为何仍未给出交房的具体日期？, 六年的时间过去了，河驻店舆房局到底在拖延什么，为什么不解决交房问题？",4.616607069969177
本人在工地干活造成韧带拉伤劳务公司不给赔钱咋办,"我在工地上工作时韧带受伤，劳务公司拒绝赔偿，应该怎么办？, 工地工作中韧带受伤，劳务公司不愿赔偿，应该如何处理？, 工地上因工作受伤，劳务公司不愿赔偿，我该如何处理？, 工地受伤导致韧带拉伤，劳务公司不愿赔偿，应该如何要求赔偿？, 我的韧带在工地干活时受伤，劳务公司不赔偿，我该如何要求赔偿？",7.5065619349479675
婚后个人买的保险属于个人财产吗,"婚后购买的保险是否属于个人财产？, 婚前购买的保险，婚后是否还属于个人财产？, 结婚后为自己购买的保险，是否属于婚后个人财产？, 婚前个人购买的保险婚后是否仍视为个人财产？, 个人婚前购买的保险，婚后是否视为夫妻共同财产？",7.483190059661865
办理离婚协议注意哪些问题,"离婚前，夫妻双方应确保是自愿离婚吗？, 离婚时，夫妻双方应如何分割财产？, 离婚协议中的财产分割是否应优先考虑夫妻双方的实际情况？, 在离婚协议中，夫妻是否应列明婚前和婚后的财产清单？, 离婚协议中，是否需要详细注明财产的购买时间和所有权归属？",4.1716103702783585
"右手大拇指除外,手掌断离已接好,无名指与小指断掉了一截,请问是几级伤残","我的右手大拇指完好无损，但手掌断离已接好，无名指和小指缺失一部分，这属于几级伤残？, 如果右手大拇指没有受伤，手掌断离已接好，但无名指和小指缺失一部分，这种情况应该评定为几级伤残？, 右手大拇指完好无损，手掌已接合，但无名指和小指丧失了一部分，这种情况的伤残等级是几级？, 如果右手大拇指完好无损，手掌修复完成，无名指和小指缺失一些部分，这属于几级伤残？, 右手大拇指没有伤害，手掌已接好，无名指和小指缺失部分，伤残等级应评为几级？",7.297121465206146
补回来的银行卡有交易记录吗？,"补办的银行卡上会有之前的交易记录吗？, 补办的银行卡能看到原卡上的交易记录吗？, 补办的银行卡是否能查看之前的交易明细？, 重新补办的银行卡上是否能查到之前的交易？, 挂失补办的农行借记卡会包含原卡的交易记录吗？",6.503406345844269
贷的太少了，可以提前还清贷款，然后多贷点他用吗,"如果我还清了现有贷款，能否申请更高额度的贷款？, 如果我提前偿还贷款，是否能够申请更高额度的贷款？, 我已经还清贷款，是否能申请更高额度的贷款？, 我提前还清贷款，是否可以申请更大的贷款额度？, 我想问，如果提前还款，能否申请更高的贷款额度？",7.5075613260269165
能缓解资金周转问题吗,"申请贷款能帮助缓解资金周转困难吗？, 在资金紧张时，申请贷款能有效缓解现金流压力吗？, 面对资金短缺，申请贷款是否能够解决资金周转问题？, 资金不足时，申请贷款是否能够迅速解决问题？, 在急需资金时，贷款是否能够及时解决问题？",5.756302386522293
农行公户转对方农行公公要不要手续费,"农行公户转账到对方农行公户需要手续费吗？, 从一个农业银行公户转账到同一家银行的公户需要手续费吗？, 从一个农行公户转账到另一个农行公户要收费吗？, 转账到另一个农行公户时，手续费标准是什么？, 转账至农行的另一个公户是否会收取手续费？",5.9284961223602295
农行网银登录进去显示不出是怎么回事,"为什么我在登录农行网银时，页面显示不出来？, 为什么在登录农业银行网银时，页面无法正常显示？, 为什么登录农业银行网银时，页面始终无法显示正常内容？, 为什么农业银行网银登录页面始终没有显示任何信息？, 我在登录农行网银时，页面没有显示任何内容，怎么办？",6.181279182434082
想借高利贷需要什么,"借高利贷需要哪些条件？, 借高利贷需要准备哪些资料？, 申请高利贷时，借款人需要提供哪些信息？, 借高利贷的风险是什么？, 高利贷的申请流程是怎样的？",5.398611128330231
哪里住宿便宜，最便宜的那种,"农行的ETC信用卡持卡人如何领取酒店现金券？, ETC信用卡持卡人如何才能免费领取酒店现金券？, 怎样通过农行信用卡优惠频道领取酒店现金券？, 农行ETC卡用户能否享受酒店现金券优惠？, 如何通过农行官网查询300元酒店现金券的领取方式？",5.666717499494553
农行同行跨省多久到账,"农行跨省转账一般多久到账？, 通过农行个人掌银转账，多久能到账？, 从农行个人网银转账到本行需要多久才能到账？, 使用农行的普通转账，多久能够到账？, 使用农行普通转账方式，款项多长时间能到账？",5.678656220436096
我在农行有房贷了还可以办理车贷吗,"我已经在农行有房贷了，能否再申请车贷？, 已经在农行办理房贷，能否继续申请车贷？, 如果我在农行已有房贷，是否能同时办理车贷？, 我在农行有房贷，能不能同时办理车贷？, 我已经在农业银行有房贷，现在还可以办理车贷吗？",6.928563296794891
6320是哪个银行的号码,"6320开头的银行卡属于哪个银行？, 62##52开头的银行卡属于哪家银行？, 6320开头的卡号属于哪家银行？, 6320开头的银行卡号通常是哪家银行发行的？, 6320开头的银行卡是哪一银行的？",7.407915771007538
深圳市精工小额贷款有限公司是正规的吗？,"深圳市精工小额贷款有限公司是正规公司吗？, 深圳市精工小额贷款有限公司是正规企业吗？, 深圳精工小额贷款公司是正规的贷款平台吗？, 深圳精工小额贷款公司的经营模式合规吗？, 深圳精工小额贷款有限公司是否合法经营？",7.359437704086304
银行贵宾卡有什么特权，什么银行的最好用,"贵宾卡的特权有哪些？, 贵宾卡的贵宾客户有哪些专属服务？, 什么是贵宾客户？贵宾卡能提供哪些专享服务？, 银行的贵宾卡提供哪些高端客户服务？, 贵宾卡包含哪些高端服务项目？",5.488613784313202
老农提额失败，过多久可以重新申请提额,"农行信用卡提额失败后，需要多久才能重新申请提升额度？, 农行信用卡提额失败后，多久之后才可以再次尝试申请提升额度？, 农行信用卡提额失败，隔多久才能再次提交提升额度申请？, 农行信用卡提额失败，隔多久可以再次申请提高额度？, 申请农行信用卡提升额度失败，过多久可以重新发起请求？",7.888523459434509
国旭小额贷款可靠不,"国旭小额贷款是否值得信赖？, 国旭小额贷款是否有隐性费用？, 国旭小额贷款的信用保障如何？, 国旭小额贷款的信誉如何？, 国旭小额贷款的风险评估机制如何？",6.161333829164505
广州市盛融小额贷款股份有限公司是骗子公司吗？,"广州市盛融小额贷款股份有限公司是否是一家可靠的公司？, 广州市盛融小额贷款公司是不是一个不正规的贷款平台？, 广州市盛融小额贷款公司是否能提供正规贷款服务？, 如何确认广州市盛融小额贷款股份有限公司的合法性？, 盛融小额贷款公司是否存在欺诈行为？",6.155313283205032
农业银行APP申请的信用卡要去面签吗,"农业银行申请信用卡后需要去网点面签吗？, 在农业银行申请信用卡通过后，还需去网点面签吗？, 申请农业银行信用卡后，是否必须到指定网点面签？, 农业银行信用卡审核通过后，是否要到网点面签？, 信用卡申请通过后，农业银行是否要求持卡人到网点面签？",7.094513714313507
贵宾卡怎么做，贵宾卡有什么用处，贵宾卡大概多少钱,"贵宾卡有哪些主要功能？, 贵宾卡的机场服务有哪些具体项目？, 贵宾卡的贵宾客户服务有哪些专属优势？, 贵宾卡在机场享受哪些特权服务？, 贵宾卡可以为客户提供哪些专属服务？",5.395777195692062
刚出学校，想办信用卡，老是办不下来，怎么办呀,"我刚毕业，想办信用卡但一直办不下来，该怎么办？, 我刚毕业，办信用卡老是被拒绝，应该怎么办？, 刚毕业找工作，信用卡申请一直被拒，怎么办？, 我刚毕业，信用卡申请总是被拒，有什么方法可以办理？, 我刚从学校毕业，信用卡申请遇到困难，有什么途径能解决？",6.041545391082764
为人民服务的岗位，为什么不能贷款,"为什么我不能申请农行的贷款？, 为什么某些岗位不能办理农业银行的贷款？, 我符合条件为什么还是不能申请农业银行贷款？, 为什么不能在农业银行办理贷款？, 为什么无法通过农业银行申请贷款？",6.885915517807007
农业信用卡被锁定有申请解冻成功的短信吗,"农业信用卡被锁定后，是否有收到解冻成功的通知短信？, 解冻农业信用卡后，我是否能收到相关的解冻成功短信？, 农业信用卡解冻后，是否能收到银行的确认短信？, 解冻农业信用卡后，我会收到银行发送的成功解冻短信吗？, 我的农业信用卡被冻结了，申请解冻后是否会收到确认短信？",6.672542214393616
农行信用卡正常使用被冻结，怎么办？,"我的农行信用卡被冻结了，应该怎么解决？, 我的农行信用卡被冻结了，怎么办才能解除？, 我的农行信用卡被冻结了，我该如何确认冻结原因？, 农行信用卡被冻结了，我该怎样找出冻结的原因？, 如果农行信用卡被冻结了，应该如何处理？",7.3925007581710815
过生日了银行会发短信祝福吗？,"农行客户生日会收到祝福短信吗？, 农行的客户会在生日当天收到祝福短信吗？, 农行会在生日时给客户发祝福短信吗？, 农行会在客户的生日给我发祝福短信吗？, 农行是否会在客户生日时发送祝福短信？",7.417983829975128
网贷哪个口子容易放款,"网贷哪个平台容易审批放款？, 哪些网贷平台能够快速审批放款？, 哪个网贷平台可以快速放款？, 哪些网贷平台比较容易批准贷款？, 哪些网贷平台的放款审批速度最快？",6.961695849895477
人力资源和社会保障卡能贷款吗,"人力资源和社会保障卡能用于申请贷款吗？, 劳动和社会保障卡可以作为贷款申请的一部分吗？, 社会保障卡是否能作为贷款申请的有效证明？, 社会保障卡能否作为贷款的审批标准之一？, 社保卡是否可以作为贷款审核的依据？",5.7893359661102295
现金速递可以不还吗,"现金速递如果没有钱能不能不还？, 如果没钱，能不能不还现金速递的款？, 没有钱能不能不还现金速递贷款？, 没钱的话，现金速递能不能延迟不还？, 没钱了，现金速递借款能否不用还？",6.255006313323975
现金速递以后上征信吗？,"现金速递的借款会影响征信记录吗？, 现金速递的贷款会不会影响征信？, 现金速递的贷款会影响我的信用吗？, 现金速递借款是否会影响个人信用记录？, 现金速递借款是否会影响信用评估？",7.218820929527283
现金速递逾期能拖多久？,"现金速递逾期后可以拖延多长时间？, 现金速递逾期后，最迟可以拖多长时间还款？, 现金速递逾期后，可以延迟多少天才不会有太大后果？, 现金速递逾期后，能拖多少天才不会被催款？, 现金速递逾期之后，能延期多少天才不会影响信用评分？",6.032786935567856
货上钱上征信查征信吗,"在申请网捷贷时，是否会查征信记录？, 申请网捷贷的审批速度是否与征信记录有关？, 申请网捷贷时是否会检查我的信用评分？, 申请网捷贷是否需要提供征信报告？, 网捷贷申请过程中是否涉及到征信查询？",6.016336143016815
新手贷款，是去银行还是找第三方比较合适？,"新手贷款是选择银行好，还是找第三方机构更合适？, 新手贷款，是去银行找贷款更安全，还是选择第三方机构服务？, 新手贷款时，是选择银行贷款更保险，还是第三方贷款更方便？, 选择银行贷款还是找第三方贷款平台，哪个更适合新手？, 贷款新手去银行还是找第三方贷款机构更值得推荐？",6.2724050879478455
现金速递会打电话给贷款者吗,"现金速递会经常打电话给借款人吗？, 现金速递会不停打电话给贷款人吗？, 现金速递是否会经常给贷款者打电话？, 现金速递是否会给贷款者打很多电话？, 贷款人借款时，现金速递会不会一直打电话？",6.884679079055786
有什么贷款软件好用？,"有哪些贷款软件比较好用？, 哪些贷款平台比较靠谱？, 哪些贷款软件适合信用良好的用户？, 有哪些贷款软件是无抵押的小额贷款？, 哪些贷款平台审批速度快且方便？",4.792200922966003
拍拍贷发信息说借款成功，钱怎么还没到账？？？,"为什么我借款成功了，但钱还没有到账？, 为什么我借款已经成功，但款项还没有到账？, 为什么我借款通过后，钱还没有进入我的账户？, 我已经成功借款，怎么还没有看到款项到我的账户？, 我的借款成功了，可是钱怎么还没转到我账户？",6.399978578090668
已经在线下申请了还能再申请宜人贷吗,"我已经在线下申请了贷款，能否再次申请宜人贷？, 我已经通过线下途径提交了贷款申请，能否再次通过其他方式申请宜人贷？, 我已经在线下完成了贷款申请，是否还可以通过网上渠道申请宜人贷？, 如果我已经通过线下申请了贷款，是否还能通过网络申请宜人贷？, 如果已经在线下提交了贷款申请，我还能再尝试申请宜人贷吗？",7.082710683345795
通安驿镇贷款公司/小额贷款哪里好,"通安驿镇有哪些靠谱的小额贷款公司？, 在通安驿镇有哪些信任度高的贷款公司？, 通安驿镇的贷款公司中，哪些值得信赖？, 通安驿镇的小额贷款选择中，哪些比较靠谱？, 通安驿镇的小额贷款公司哪个比较好？",6.013739734888077
如订单支付超时，我需要怎么做才能重新支付,"如果订单支付超时，我该如何重新支付？, 订单支付超时，我如何重新尝试支付？, 订单支付超时，如何重新操作完成支付？, 订单支付失败后，如何重新尝试支付？, 订单支付超时，如何恢复支付并完成付款？",7.447925269603729
共分三次分别转入共18万，到银行查账后分别被转到三个地方这种情况怎么处理谢谢,"我通过分三次向银行转账18万，之后资金被转到三个不同的账户，这种情况该如何处理？, 我分三次向银行汇款18万，钱被转到三个不同账户，这个情况该如何处理？, 我向银行转账18万分三次，但钱被转到三个不同账户，该如何处理？, 我把18万分三次存入银行，之后资金被转到三个不同的账户，应该如何解决？, 我分三次转账18万到银行，之后资金转移到三个账户，如何处理这种情况？",7.9129475355148315
是不是用谁的身份证网贷，就必须要用谁名下的银行卡？有没有例外的？,"办理网贷时，是否必须使用贷款人名下的银行卡？, 办理农行网贷时，是否必须使用贷款人的银行卡？, 是否所有银行网贷都要求使用贷款人名下的银行卡办理？, 是否可以使用非贷款人名下的银行卡办理网贷？, 办理网贷时，贷款人和银行卡的名下是否需要一致？",6.643859088420868
哪里有卖银行卡账号的,"银行卡账号可以购买吗？, 如何获取银行卡账号，可以通过购买吗？, 可以通过购买银行卡获得账号吗？, 是否可以通过购买方式获得银行卡账号？, 可以通过购买获得农业银行的银行卡号吗？",6.346770823001862
手机网上银行打不开怎么回事，怎么办,"为什么我的手机无法通过浏览器登陆网上银行？, 为什么我的手机通过浏览器无法进入网上银行？, 为什么我的三星手机浏览器不能登陆网上银行？, 如何解决手机无法通过浏览器访问网上银行的问题？, 如何修复手机浏览器无法访问网上银行的问题？",6.602469980716705
把20万存农行定期一年的整存整取利息是多少钱,"如果我把20万元存入农行定期一年，利息是多少？, 我把20万元存入农行定期一年，年利息大概是多少？, 我把20万元存进农行一年定期，利息多少？, 如果我将20万存入农行一年期定期，能获得多少利息？, 如果将20万存农行定期一年，利息是多少？",8.25534462928772
重庆阿里小微小额贷款有限公司电话号码是多少,"重庆阿里小微小额贷款有限公司的联系电话是多少？, 重庆阿里小微小额贷款有限公司客服电话是多少？, 请问重庆阿里小微小额贷款有限公司电话是多少？, 重庆阿里小微小额贷款公司联系电话是什么？, 重庆阿里小微小额贷款有限公司的联系方式可以在哪里找到？",7.596075534820557
百度理财的钱有保险吗,"百度理财产品是否有保险保障？, 百度理财的产品是否可以享受保险保障？, 百度理财产品是否需要额外购买保险？, 是否可以通过百度理财产品购买保险服务？, 中国农业银行理财产品是否有保险服务？",5.977663725614548
三年10万下来利息多少,"三年存款10万元，能获得多少利息？, 三年10万元定期存款，最终能拿到多少利息？, 存款10万元三年，最后能赚多少利息？, 存款10万三年，能获取多少利息？, 10万元存三年，能得到多少利息？",8.139878511428833
小花钱包额度怎么提升？,"小花钱包的额度如何提升？, 小花钱包的额度如何通过正规途径提升？, 小花钱包的额度能通过哪些渠道提高？, 小花钱包额度提升的途径是什么？, 小花钱包额度提高的条件是什么？",6.767911851406097
小花钱包额度只有1500怎么办？,"小花的钱包额度只有1500，怎么办？, 我的钱包额度只有1500元，能怎么解决？, 如果我的钱包额度只有1500，能申请更高的额度吗？, 钱包额度只有1500，怎样才能获得更多的贷款？, 我的额度只有1500，如何才能获得更大的贷款额度？",5.6543630957603455
小花钱包到账需要多久,"小花钱包申请后多久能够到账？, 申请小花钱包之后多久才能收到款项？, 申请小花钱包贷款需要等多久才能收到款项？, 小花钱包贷款申请后需要几天才能收到资金？, 小花钱包贷款通过审核后需要等多久才能放款？",6.065048485994339
菜鸟理财的会员怎么样,"菜鸟理财的会员如何，可靠吗？, 你认为菜鸟理财的会员服务怎么样？, 你认为菜鸟理财的产品适合什么样的投资者？, 哪种理财方式最适合我作为菜鸟理财的会员？, 菜鸟理财的理财计划是否适合长期投资？",4.415474504232407
我前个星期周五下午4点多公卡跨行转账三万到农业银行，这个星期周三早上还没到账？,"上周五下午4点多我从公卡进行了一笔跨行转账，金额三万，为什么到今天周三早上还没到账？, 上周五下午四点多我进行了三万元的跨行转账，今天周三早上还是没有到账，为什么？, 上周五下午四点通过公卡做了三万的跨行转账，为什么周三早上还没到账？, 上周五下午4点多通过公卡跨行转账三万，为什么本周三早上还没有到账？, 为什么我上周五下午4点通过公卡跨行转账三万元，本周三早上还没到账？",8.136323690414429
小花钱包最多借多少？,"小花钱包最多可以借到多少钱？, 小花钱包最高可以借多少额度？, 小花钱包最高可以借款多少资金？, 小花钱包最多能借多少？, 小花钱包能借到的最大金额是多少？",7.3550549149513245
加元理财好还是英镑理财好,"选择加元理财还是英镑理财更好？, 选择加元理财还是英镑理财能获得更好的回报？, 选择加元理财与英镑理财哪个收益更高？, 是选择加元理财产品还是英镑理财产品更合适？, 应该选择加元理财还是英镑理财产品？",6.589584112167358
安创理财提现怎么还没到,"为什么我的理财提现还没有到账？, 为什么我的农业银行理财提现款项还没有到账？, 为什么我从农业银行提现的理财款项还没到？, 为什么我在农行提现的理财款项没有按时到账？, 为什么我提现的农业银行理财资金还没有到我的卡里？",6.9215182065963745
百广在线有理财资质吗,"百广在线是否具备理财资质？, 百广在线是否具备合法理财资质？, 百广在线是否有投资理财的合法资质？, 百广在线是否具备正规的理财服务资格？, 百广在线是否拥有理财业务相关资质？",7.308753430843353
有理树理财回款即时吗,"我可以随时取回我购买的理财产品吗？, 我购买的理财产品是随时可以赎回的吗？, 我购买的理财产品是否能即时赎回并回款？, 我的理财产品回款是否是即时处理的？, 中国农业银行的理财产品可以即时回款吗？",5.295244485139847
联通20块钱14个G的流量，是真的吗,"20块钱可以购买14GB的流量吗？, 20块钱可以购买14GB流量服务吗？, 20元能买到14GB的流量吗？, 20元能兑换14GB的流量套餐吗？, 20元能办理14GB流量套餐吗？",7.372366368770599
联通卡月底开通冰淇淋不限流量套餐怎么收费,"联通卡开通冰淇淋不限流量套餐的收费标准是什么？, 联通卡开通冰淇淋不限流量套餐的具体费用是什么？, 联通开通冰淇淋不限流量套餐的收费明细是怎样的？, 开通冰淇淋不限流量套餐，联通的收费标准是怎样的？, 如果开通冰淇淋不限流量套餐，联通卡的月费用是多少？",7.603262364864349
流量用完都怎么办了,"如果流量用完了怎么办？, 如果手机流量用完了，怎样才能再次上网？, 如果我的数据流量用光了，如何恢复？, 我的流量用完了，接下来应该怎么办？, 流量用光后，接下来应该怎么办？",5.5412406623363495
大王卡亲情卡怎么退款,"大王卡亲情卡如何办理退款？, 大王卡亲情卡怎么申请退费？, 怎么申请大王卡亲情卡退款？, 如何取消大王卡亲情卡并申请退款？, 大王卡亲情卡能退款吗？要怎么操作？",7.036255598068237
一夜了流量还没到账.也找不到客服，怎么办,"为什么我的流量还没到账，已经过了一夜了？, 为什么我的流量到现在还没有到账，已经等了一夜？, 我的流量已经等了一晚上，为什么还没有到账？, 我的流量申请已经过去了一晚上，为什么还没到账？, 一晚上过去了，为什么我的流量还没有到账？",7.100396752357483
联通人工客服怎么进去,"我怎样才能联系到人工客服？, 我怎样才能通过系统联系到人工客服？, 我怎么才能通过平台联系人工客服？, 我怎么才能找到人工客服？, 我怎样才能和人工客服进行对话？",7.633148908615112
哪个平台手机充值话费优惠一些,"哪个平台的手机话费充值有更多的优惠活动？, 哪个平台充值手机话费能得到更多优惠？, 哪个手机平台充值话费能享受更多优惠？, 手机话费充值在哪个平台能享受更大折扣？, 手机话费在哪个平台充值最有优惠？",7.502282500267029
流量如何变成积分,"流量如何转化为积分？, 流量怎么转化为积分？, 流量要如何才能转变为积分？, 流量如何才能变现为积分？, 流量怎么才能变成积分？",7.747658789157867
